Timestamps,Content
28:41.000 --> 28:43.000,"on the Orthodox understanding,"
28:43.000 --> 28:48.000,we should not share in the sacraments.
28:48.000 --> 28:52.000,"However, I speak of agreement in faith,"
28:52.000 --> 28:57.000,not agreement in theological opinions.
28:57.000 --> 28:58.000,There is room
28:58.000 --> 29:03.000,for diversity of viewpoints.
29:03.000 --> 29:05.000,"What we are seeking is unity,"
29:05.000 --> 29:07.000,not uniformity.
29:07.000 --> 29:09.000,And what we have to clarify
29:09.000 --> 29:11.000,when we as separated Christians
29:11.000 --> 29:13.000,talk together is
29:13.000 --> 29:15.000,which things belong
29:15.000 --> 29:17.000,to the heart and essence
29:17.000 --> 29:19.000,of the Christian faith
29:19.000 --> 29:21.000,"on which we must agree,"
29:21.000 --> 29:24.000,and which things can be left
29:24.000 --> 29:27.000,to private opinion.
29:28.000 --> 29:31.000,"Now, the different Christian groups"
29:31.000 --> 29:35.000,do not agree on where to draw the line.
29:35.000 --> 29:39.000,"So, we do need to be one in faith"
29:39.000 --> 29:42.000,in order to be one in the sacraments.
29:42.000 --> 29:45.000,But unity in the vision of Christ
29:45.000 --> 29:48.000,was indeed to be visible
29:48.000 --> 29:52.000,"because it is founded on the Holy Eucharist,"
29:52.000 --> 29:55.000,which is a visible action.
29:55.000 --> 29:57.000,Or how that would work out
29:57.000 --> 29:59.000,"in a practical way,"
29:59.000 --> 30:02.000,if there's any consensus on that
30:02.000 --> 30:03.000,among the Orthodox.
30:03.000 --> 30:04.000,"The phrase,"
30:04.000 --> 30:06.000,"first among equals,"
30:06.000 --> 30:08.000,"is often applied,"
30:08.000 --> 30:09.000,"is it not,"
30:09.000 --> 30:11.000,to the Pope.
30:11.000 --> 30:12.000,And that is probably
30:12.000 --> 30:14.000,"what you are thinking of,"
30:14.000 --> 30:16.000,the way it is applied to the Pope.
30:16.000 --> 30:19.000,There are three levels of authority
30:19.000 --> 30:21.000,in the Church.
30:21.000 --> 30:24.000,And this was recently stated
30:24.000 --> 30:27.000,in the revenge
30:27.000 --> 30:29.000,document put out
30:29.000 --> 30:31.000,by the International Commission
30:31.000 --> 30:34.000,for dialogue between the Orthodox
30:34.000 --> 30:36.000,and the Roman Catholics
30:36.000 --> 30:40.000,in 2007.
30:40.000 --> 30:43.000,And the revenge document distinguishes
30:43.000 --> 30:46.000,first the authority
30:46.000 --> 30:48.000,of the local bishop
30:48.000 --> 30:51.000,in his diocese.
30:51.000 --> 30:55.000,Then you have regional authority
30:55.000 --> 30:57.000,or regional primacy.
30:57.000 --> 31:01.000,And that means for us Orthodox
31:01.000 --> 31:04.000,the position of the patriarchs
31:04.000 --> 31:07.000,and heads of the autocephalous churches.
31:07.000 --> 31:09.000,"And then thirdly,"
31:09.000 --> 31:11.000,the Ravenna document
31:11.000 --> 31:15.000,distinguished the universal primacy
31:15.000 --> 31:18.000,of the Pope.
31:18.000 --> 31:22.000,Now I think the phrase
31:22.000 --> 31:25.000,first among equals
31:25.000 --> 31:28.000,applies to the second level.
31:28.000 --> 31:30.000,The Pope is the senior
31:30.000 --> 31:32.000,among the patriarchs
31:32.000 --> 31:34.000,and therefore
31:34.000 --> 31:37.000,the first among equals.
31:37.000 --> 31:40.000,But Ravenna also said
31:40.000 --> 31:43.000,and the Orthodox agreed with this
31:43.000 --> 31:46.000,that the Pope does have
31:46.000 --> 31:49.000,a special ministry
31:49.000 --> 31:52.000,beyond that of being patriarch
31:52.000 --> 31:54.000,in the West.
31:54.000 --> 31:57.000,That he is also endowed
31:57.000 --> 31:59.000,with a universal authority
31:59.000 --> 32:02.000,over the whole church.
32:02.000 --> 32:05.000,Not a power of direct jurisdiction
32:05.000 --> 32:08.000,on the Orthodox understanding.
32:08.000 --> 32:12.000,But he has a certain ministry
32:12.000 --> 32:16.000,to watch over the unity
32:16.000 --> 32:18.000,of the church.
32:18.000 --> 32:21.000,But the Ravenna document says
32:21.000 --> 32:24.000,there must be mutual consultation
32:24.000 --> 32:26.000,the Pope as first
32:26.000 --> 32:28.000,should not do anything
32:28.000 --> 32:32.000,without consulting the patriarchs
32:32.000 --> 32:34.000,and they should not do anything
32:34.000 --> 32:36.000,without consulting the Pope.
32:36.000 --> 32:39.000,Mutual consultation.
32:39.000 --> 32:42.000,All of this is implied
32:42.000 --> 32:44.000,in the Ravenna document
32:44.000 --> 32:47.000,rather than stated clearly.
32:47.000 --> 32:50.000,But there is there the suggestion
32:50.000 --> 32:52.000,that the Pope
32:52.000 --> 32:56.000,as supreme pontiff
32:56.000 --> 32:58.000,has a ministry
32:58.000 --> 33:00.000,that is different from that
33:00.000 --> 33:02.000,of the other patriarchs.
33:02.000 --> 33:05.000,Now not all Orthodox would accept that.
33:05.000 --> 33:08.000,But the Orthodox at Ravenna agreed to it.
33:08.000 --> 33:10.000,However we are now having
33:10.000 --> 33:12.000,further discussions to work out
33:12.000 --> 33:15.000,exactly what this signifies.
33:15.000 --> 33:18.000,So the title first among equals
33:18.000 --> 33:20.000,applies really to the middle
33:20.000 --> 33:21.000,level of authority.
33:21.000 --> 33:24.000,What I call regional primacy.
33:24.000 --> 33:26.000,The patriarchs.
33:26.000 --> 33:30.000,But there is an understanding
33:30.000 --> 33:32.000,among many Orthodox
33:32.000 --> 33:35.000,that the Pope has a special position
33:35.000 --> 33:36.000,in the church.
33:36.000 --> 33:39.000,And there is plenty of evidence
33:39.000 --> 33:41.000,to support that
33:41.000 --> 33:43.000,from the first millennium
33:43.000 --> 33:46.000,when there was communion between us.
33:46.000 --> 33:48.000,And we are looking at that evidence
33:48.000 --> 33:49.000,at the moment
33:49.000 --> 33:50.000,and trying to see
33:50.000 --> 33:51.000,whether we can reach
33:51.000 --> 33:54.000,a common understanding on this basis.
33:54.000 --> 33:55.000,What would you say to Christians
33:55.000 --> 33:56.000,of all stripes
33:56.000 --> 33:58.000,whether Southern Baptist
33:58.000 --> 33:59.000,or Methodist
33:59.000 --> 34:00.000,or Catholic
34:00.000 --> 34:03.000,or even Eastern Orthodox
34:03.000 --> 34:05.000,that they can do to work for
34:05.000 --> 34:07.000,in their own small ways
34:07.000 --> 34:10.000,greater unity among one another?
34:10.000 --> 34:12.000,The most important thing
34:12.000 --> 34:14.000,that we can do
34:14.000 --> 34:17.000,to bring about greater unity
34:17.000 --> 34:19.000,is for each one of us
34:19.000 --> 34:25.000,in our different church traditions
34:25.000 --> 34:29.000,to come closer to Christ.
34:29.000 --> 34:31.000,Three things go together
34:31.000 --> 34:34.000,in work for unity.
34:34.000 --> 34:38.000,"Truth, unity and holiness."
34:38.000 --> 34:40.000,There can be no unity
34:40.000 --> 34:43.000,except unity in the truth.
34:43.000 --> 34:46.000,But also there can be no unity
34:46.000 --> 34:48.000,except unity
34:48.000 --> 34:50.000,in holiness.
34:50.000 --> 34:54.000,If we would all draw nearer to Christ
34:54.000 --> 34:56.000,we would also
34:56.000 --> 35:00.000,all of us draw nearer to one another.
35:00.000 --> 35:02.000,So the best thing we can do
35:02.000 --> 35:04.000,to help the work of Christianity
35:04.000 --> 35:06.000,the work of Christian unity
35:06.000 --> 35:08.000,each one of us
35:08.000 --> 35:10.000,is to be converted
35:10.000 --> 35:12.000,more deeply
35:12.000 --> 35:14.000,more radically
35:14.000 --> 35:16.000,to Christ
35:16.000 --> 35:18.000,our one Saviour.
35:18.000 --> 35:19.000,Amen.
